name;profile;url;categories;mobile;fax;email;website;address;data_source;category;sub-category;online;designation;poc
Arcade Tailoring Company;Singapore Suppliers of Clothing, Clothes, Garments, Manufacturers, Wholesalers, Retailers Clothing Manufacturers, Clothing Wholesalers, Clothing Distributors;http://singapore-companies-directory.com/Company_Profiles/A123/arcade_tailoring.htm;Clothing, Clothes, Garments,  Manufacturers, Wholesalers, Retailers;(+65) 6348-3750;;;;30, Amber Gdns Amber Glades Singapore 439964;singapore-companies-directory.com;Mens Fasion;Tailors;Offline;;
Aspirez LLP;Singapore company which specialises in the wholesale and distribution of executive accessories, Ties, Cufflinks through an established supply network, our clients enjoy efficient and reliable services from us.;http://singapore-companies-directory.com/Company_Profiles/A151/aspirez.htm;Ties, Cufflinks;(+65) 6397-2616;(+65) 6397-2616;ferrine@aspirez.com.sg;;Ferrine Seik  11 Lucky Heights Singapore;singapore-companies-directory.com;Mens Fasion;Tailors;Online;;Ferrine Seik 
B' Exclusive Enterprise;Singapore Dressmakers, Clothing, Clothes, Garments, Manufacturers, Tailors, Tailoring Supplies;http://singapore-companies-directory.com/Company_Profiles/B4/b_exclusive_enterprise.htm;Dressmakers, Clothing, Clothes, Garments,  Manufacturers;(+65) 6836-8366;;;;466, River Valley Rd  Singapore 248351;singapore-companies-directory.com;Mens Fasion;Tailors;Offline;;
Chia Yi Alteration;Singapore Women Tailoring, Singapore Dressmakers, Clothing, Clothes, Garments;http://singapore-companies-directory.com/Company_Profiles/C49/chia_yi_alteration.htm;Women Tailoring, Dressmakers, Clothing,  Clothes, Garments;(+65) 6426-9295;;;;3, Simei St 6 #B1-07  Singapore 528833;singapore-companies-directory.com;Mens Fasion;Tailors;Offline;;
Christian Armani Ladies & Gents;Singapore Tailors, Tailoring Supplies, Men's Wear, Clothing, Clothes, Garments, Manufacturers, Wholesalers, Retailers;http://singapore-companies-directory.com/Company_Profiles/C66/christian_armani_ladies_gents.htm;Tailors, Tailoring Supplies, Men's Wear;(+65) 6733-6407;(+65) 6733-6427;;;14 Scotts Road #02-115 Far East Plaza  Singapore 228213;singapore-companies-directory.com;Mens Fasion;Tailors;Offline;;PREM KHIATANI
F-B Fashion & Beauty;Singapore Beauty Salons, Hairdressers, Boutiques, Dressmakers, Clothes Shops, Clothing, Fashion Retailers, Beauty Aids, Beauty Services, Beauty Therapy, Dresses, Fashion Services, Hairdressing Services, Used Clothing, Women Tailoring;http://singapore-companies-directory.com/Company_Profiles/F1/fb_fashion_beauty.htm;Beauty Salons, Hairdressers, Boutiques,  Dressmakers, Clothes Shops, Clothing, Fashion Retailers;(+65) 6442-6678;;;;73 Bedok South Avenue 3, #01-458  Singapore 460073;singapore-companies-directory.com;Mens Fasion;Tailors;Offline;;
