Adidas Singapore Pte Ltd,,,,,(+65) 6538-6200,(+65) 6538-6400,3 ANSON ROAD #27-01 Singapore 150168,Offline,Mens Fasion,Shoes,"Sports Equipment, Sport Supplies,  Sporting Goods","Singapore Sportswear Company Suppliers of Sports Equipment, Sports Footwear, Sports Shoes, Sport Supplies, Sporting Goods. Clothing and Shoes Stores We strive to be the global leader in the sporting goods industry with sports brands built on a passion for sports and a sporting lifestyle"
Aldo Brue Asia Pte Ltd,,,,,(+65) 6274-1292,,"1, Maritime Sq #01-79 HarbourFront Centre Singapore 099253",Offline,Mens Fasion,Shoes,"Shoes, Footwear Manufacturers,  Wholesalers, Distributors","Singapore Footwear Manufacturers, Shoes, Footwear Manufacturers, Wholesalers, Distributors, Shoes Manufacturers, Shoes Wholesalers, Shoes Distributors, Footwear Wholesalers, Footwear Distributors"
Alentino Creation Pte Ltd,,,,,(+65) 6793-5503,(+65) 6536-6629,"1, Jurong West Central 2 #02-15 Jurong Pt Shopping Centre Singapore 648886",Offline,Mens Fasion,Shoes,"Shoes, Footwear Manufacturers,  Wholesalers, Distributors","Singapore Shoes Manufacturers, Shoes Wholesalers, Shoes Distributors, Footwear Manufacturers, Footwear Wholesalers, Footwear Distributors"
Allstate (S) Pte Ltd,,,,,(+65) 6743-1773,(+65) 6743-1750,"1057, Eunos Ave 3 Singapore 409848",Offline,Mens Fasion,Shoes,"Footwear, Shoes Manufacturers, Shoes  Wholesalers","Singapore Shoes Manufacturers, Shoes Wholesalers, Shoes Distributors, Footwear Manufacturers, Footwear Wholesalers, Footwear Distributors"
Alpha Sky Pte Ltd,,,,,(+65) 6376-0898,,"16, Jln Kilang Timor #07-03 Singapore 159308",Offline,Mens Fasion,Shoes,"Shoes, Footwear Manufacturers, Footwear  Wholesalers, Footwear Distributors","Singapore Shoe Manufacturers, Shoes Wholesalers, Shoes Distributors, Footwear Manufacturers, Footwear Wholesalers, Footwear Distributors"
Americaya (S) Pte Ltd,,,,,(+65) 6298-9433,,"9, Kallang Pl #06-11 Kallang Basin Ind Est Singapore 339154",Offline,Mens Fasion,Shoes,"Shoes, Shoes Manufacturers, Shoes  Wholesalers, Shoes Distributors, Footwear Manufacturers,  Footwear Wholesalers, Footwear Distributors","Singapore Footwear Company Suppliers of Shoes, Shoes Manufacturers, Shoes Wholesalers, Shoes Distributors, Footwear Manufacturers, Footwear Wholesalers, Footwear Distributors"
Avichem International Inc,"Varadarajan Nandakumar  No.961, Upper Changi Road North, Block A, Changi",,,,(+65) 6545-8229,(+65) 6545-9924,"Varadarajan Nandakumar  No.961, Upper Changi Road North, Block A, Changi Garden Singapore",Offline,Mens Fasion,Shoes,"Cement, Sugar, Steel Scrap, Coal &  Chemicals","Singapore Trading Company dealing in bulk commodities such as Cement, Sugar, Steel Scrap, Coal, Chemicals, Leather Shoes, Pharmaceuticals, Herbal Cosmetics"
BHG (Singapore) Pte Ltd,,,career@bhgsingapore.com.sg,,(+65) 6223-2222,,230 VICTORIA STREET #03-01 BUGIS JUNCTION  Singapore 188024,Online,Mens Fasion,Shoes,"Department Stores, Retailers","Singapore Department Store Chain with four stores in Bugis, Choa Chu Kang, Bishan & Tampines. Owned by the Beijing Hualian Group; product categories include apparel, beauty, shoes & bags, fashion accessories, health & sports goods"
Boby Footwear Pte Ltd,Lau Wee Soong,Managing Director,general@bobygroup.com.sg,,(+65) 6469-8977,(+65) 6469-5584,2 Pandan Valley #01-200 Acacia Court  Singapore 597626,Online,Mens Fasion,Shoes,"Shoes Manufacturers, Shoes Wholesalers,  Shoes Distributors, Footwear Manufacturers","Singapore Shoes Distributors, Footwear Manufacturers, Trading, Manufacture, Retail & Wholesalers of all types of Footwear"
Champion Shoe Company,,,,,(+65) 6532-2812,(+65) 6532-2812,"101 Upper Cross Street, #02-28 People's Park Centre  Singapore 058357",Offline,Mens Fasion,Shoes,"Bags, Clothing, Belts, Fashion  Accessories, Handbags, Shoes","Singapore Suppliers of Bags, Clothing, Belts, Fashion Accessories, Handbags, Shoes, Footwear Wholesalers, Footwear Distributors"
Charles & Keith (Singapore) Pte Ltd,,,customers@charleskeith.com,,(+65) 6221-1814 (+65) 6488-2688,(+65) 6488-1649,165 Tanjong Pagar Road  Singapore,Online,Mens Fasion,Shoes,"Retail Chains, Footwear, Shoes, Bags,  Fashion Accessories","Singapore Chain of concept stores that retail shoes and bags; has stores in Singapore, Australia, Japan, Indonesia, India, Thailand, UAE, Brunei Darassalum, Mauritius, Myanmar, Taiwan, Turkey, New Zealand, Greece, Egypt, and Saudi Arabia. Retailers of Footwear, Shoes, Bags, Fashion Accessories"
Cindini Dance International,,,info@cindini.com.sg,,(+65) 6533-1013,(+65) 6533-2123,"531 Upper Cross Street, #03-47 Hong Lim Complex,  Singapore 050531",Online,Mens Fasion,Shoes,"Dancewear, Dance Shoes, Ballroom Dresses,  Latin Costumes","Singapore Suppliers of dance shoes & dance wear located at the Hong Lim Complex on Upper Cross Street; products include Ladies Dance Shoes, Mens Dance Shoes, Dancewear, Dance Apparel, Dance Sneakers, Jazz Shoes, Dance Shoe Accessories, Dance Shoe Embellishments, Dance Jewellery, Tanning Lotions, ladies & gents dance shoes, ballroom dresses, Latin costumes, pants, dance sneakers, shoe accessories"
F J Benjamin (S) Pte Ltd,,,,,(+65) 6737-0682,(+65) 6737-9939,"6B, Orchard Rd #02-02/03 The Paragon  Singapore 238859",Offline,Mens Fasion,Shoes,"Watches & Clocks, Fashion Accessories,  Fashion Clothing Wholesalers, Fashion Clothing  Manufacturers, Fashion Clothing Retailers, Boutiques,  Clothes Shops, Clothing, Fashion Retailers, Fashion  Wholesalers, Beauty Products, Cosmetics, Personal Care  Products, Footwear Wholesalers, Footwear Distributors","Singapore Boutiques, Fashion Shops, Beauty Aids, Beauty Services, Clothing Design, Fashion Services, Footwear, Ladies Shoes, Perfumes, Watch Components, Watches"
G S Gill (Pte) Ltd,,,,,(+65) 67335555,(+65) 67335575,"554 Havelock Road, #06-00 Ganges Centre  Singapore 169639",Offline,Mens Fasion,Shoes,"Golf Equipment, Golfing Supplies, Golf  Sports Goods, Sports Equipment","Singapore Sports Goods Company Suppliers of Golf Equipment, Sports Clothing, Sports Footwear, Sports Goods, Sports Equipment, Sports Accessories, Sports Services"
H & P Marketing,,,,,(+65) 6323-3027,(+65) 6323-3027,"20 Maxwell Road, #12-02a Maxwell House  Singapore 069113",Offline,Mens Fasion,Shoes,"Sports Equipment, Sport Supplies,  Sporting Goods","Singapore Sport Supplies Company Suppliers of Sports Equipment, Sporting Goods, Sports Clothing, Sports Footwear, Sports Goods, Sports Equipment, Sports Accessories, Sports Services"
